{
  "operation": "explicit-create",
  "source_files": [
    ".maestro/memory/sources/src-8f10f07960b6b8d5.json"
  ],
  "current_memory": {
    "scope": "bounded",
    "query": "项目使用 Vue 3",
    "limit": 3,
    "long_term_entries": []
  },
  "current_playbooks": [],
  "memory_hints": {
    "memory_kind": "fact"
  }
}
