{
  "operation": "worker-compress",
  "source_files": [
    "files/source.md"
  ],
  "current_memory": {
    "long_term_entries": [
      {
        "entry_id": "lt-fixture-validation",
        "title": "Fixture validation",
        "memory_kind": "decision",
        "content": "Durable fixture claims require reachable evidence.",
        "decision_context": {
          "reason": "Unsourced claims cannot be audited across Sessions.",
          "rejected_alternatives": [
            {
              "alternative": "Store claims without source references",
              "reason": "Later Agents could not distinguish evidence from generated text."
            }
          ]
        },
        "source_refs": [
          "files/source.md"
        ]
      }
    ]
  },
  "current_playbooks": [
    {
      "playbook_id": "pb-fixture-validation",
      "file_path": ".maestro/playbooks/fixture-validation.md",
      "title": "Validate protocol artifacts",
      "trigger": "A formal Maestro protocol artifact is about to be persisted.",
      "steps": [
        "Run the matching artifact-triggered protocol guard.",
        "Persist the canonical artifact only after validation succeeds."
      ],
      "checks": ["The protocol guard exits successfully."],
      "status": "active",
      "revision": 2,
      "updated_at": "2026-08-29T00:00:00Z",
      "updated_by": "old-zhou/fixture",
      "source_refs": [
        "files/source.md"
      ]
    },
    {
      "playbook_id": "pb-fixture-sources",
      "file_path": ".maestro/playbooks/fixture-sources.yaml",
      "title": "Preserve fixture sources",
      "trigger": "A fixture result needs an auditable source.",
      "steps": ["Retain a reachable source reference with the result."],
      "checks": ["The referenced source exists under the project root."],
      "status": "active",
      "revision": 1,
      "updated_at": "2026-08-29T00:01:00Z",
      "updated_by": "old-zhou/fixture",
      "source_refs": [
        "files/result.md"
      ]
    }
  ],
  "memory_hints": {}
}
